{
  "$schema": "http://json-schema.org/draft-07/schema#",
  "$id": "instance_schema.json",
  "title": "Canonical DVRPTW Snapshot Instance (v4)",
  "description": "Định dạng chung mà mọi nguồn dữ liệu (Solomon, Amazon Last-Mile, synthetic) phải normalize về. state_version định danh snapshot trạng thái; matrix_version định danh phiên bản ma trận travel time. current_stop là vị trí hiện tại theo node ID, có thể là virtual node trên đường và khi đó time_matrix của snapshot phải có hàng/cột tương ứng.",
  "type": "object",
  "required": ["instance_id", "scenario_id", "source", "depot", "vehicles", "orders", "matrix_version", "time_matrix"],
  "properties": {
    "instance_id": {
      "type": "string",
      "description": "Id của snapshot cụ thể này (StateSnapshot ở Mục 4.1) — mỗi lần re-plan sẽ có instance_id khác nhau trong cùng 1 scenario."
    },
    "scenario_id": {
      "type": "string",
      "description": "Scope của 1 simulation/experiment (Scenario entity, Mục 4.1). Với instance tĩnh độc lập (Solomon/Amazon ở W2, chưa chạy trong 1 scenario mô phỏng thật), mặc định scenario_id = instance_id."
    },
    "state_version": {
      "type": "integer",
      "minimum": 0,
      "default": 0,
      "description": "v — phiên bản snapshot dùng làm base_state_version khi tạo candidate plan. Đây là metadata điều phối, không phải biến routing. Nếu vắng mặt, W2/W3 xem snapshot là version 0."
    },
    "matrix_version": {
      "type": "integer",
      "minimum": 0,
      "description": "Phiên bản của time_matrix tại snapshot. Tăng version mỗi khi nội dung ma trận thay đổi; candidate plan ghi lại base_matrix_version để phát hiện kế hoạch được tạo từ ma trận cũ. Instance tĩnh bắt đầu ở version 0."
    },
    "source": { "type": "string", "enum": ["solomon", "amazon", "synthetic"] },

    "depot": {
      "type": "object",
      "required": ["id", "x", "y"],
      "properties": {
        "id": { "type": "string" },
        "x": { "type": "number" },
        "y": { "type": "number" }
      }
    },

    "vehicles": {
      "type": "array",
      "minItems": 1,
      "items": {
        "type": "object",
        "required": ["id", "capacity", "remaining_capacity", "status", "current_stop", "start_time"],
        "properties": {
          "id": { "type": "string" },
          "capacity": {
            "type": "number", "minimum": 0,
            "description": "Capacity GỐC của xe (không đổi trong suốt scenario)."
          },
          "remaining_capacity": {
            "type": "number", "minimum": 0,
            "description": "Q_k trong Problem Specification v1 Mục 1 — capacity CÒN LẠI tại snapshot này (đã trừ phần đang chở dở nếu xe đang EN_ROUTE). Với snapshot đầu tiên (t=0, chưa chở gì): remaining_capacity = capacity."
          },
          "status": {
            "type": "string", "enum": ["AVAILABLE", "IN_ROUTE", "UNAVAILABLE"],
            "description": "State machine Mục 4.3. UNAVAILABLE (breakdown) không được nhận order mới — validator/greedy phải loại xe này khỏi assignment."
          },
          "current_stop": {
            "type": "string",
            "description": "Vị trí hiện tại của xe tại snapshot, được biểu diễn bằng node ID trong time_matrix. Có thể là depot, customer hoặc virtual node trên một cung đường. Nếu là vị trí mới trên đường, snapshot producer phải cập nhật travel-time matrix tới/từ vị trí này trước khi solve. Optimizer sẽ tạo một solver-only virtual start riêng cho xe từ node này."
          },
          "start_time": {
            "type": "number", "minimum": 0,
            "description": "Mốc thời gian xe bắt đầu di chuyển từ current_stop trong snapshot này (không có trong bảng entity gốc, thêm vì cần cho mô phỏng arrival time — xem README)."
          }
        }
      }
    },

    "orders": {
      "type": "array",
      "items": {
        "type": "object",
        "required": ["id", "x", "y", "demand", "release_time", "ready_time", "deadline", "service_time", "status"],
        "properties": {
          "id": { "type": "string" },
          "x": { "type": "number" },
          "y": { "type": "number" },
          "demand": { "type": "number", "minimum": 0 },
          "release_time": {
            "type": "number", "minimum": 0,
            "description": "Thời điểm order XUẤT HIỆN trong scenario (khi hệ thống biết đến order này) — khác ready_time. Với instance tĩnh (mọi order biết từ đầu, đúng bản chất Solomon/Amazon snapshot 1 lần): release_time = 0 cho tất cả."
          },
          "ready_time": {
            "type": "number", "minimum": 0,
            "description": "a_i — HARD, đã chốt ở Problem Specification v1 Mục 3: không được service trước thời điểm này (được phép chờ)."
          },
          "deadline": {
            "type": "number", "minimum": 0,
            "description": "b_i — SOFT, đã chốt ở Problem Specification v1 Mục 3: cho phép trễ, bị phạt trong objective chứ không làm infeasible."
          },
          "service_time": { "type": "number", "minimum": 0 },
          "status": {
            "type": "string",
            "enum": ["CREATED", "PENDING", "ASSIGNED", "IN_SERVICE", "DELIVERED", "UNSERVED", "CANCELLED"],
            "description": "State machine Mục 4.2. Với instance tĩnh đầu vào (trước khi chạy Greedy Insertion): mặc định PENDING."
          }
        }
      }
    },

    "time_matrix": {
      "type": "object",
      "description": "Ma trận thời gian di chuyển có hướng: from_node -> to_node -> travel_time tính bằng giây (cùng đơn vị với ready_time/deadline/service_time). Trường này không lưu quãng đường. Phải chứa depot.id, mọi order.id, mọi vehicle.current_stop. Với current_stop là vị trí mới trên đường, cần có travel time từ vị trí đó tới mọi node và ngược lại trong snapshot hiện hành.",
      "additionalProperties": {
        "type": "object",
        "additionalProperties": { "type": "number", "minimum": 0 }
      }
    }
  }
}
