{
  "instance_id": "RouteID_SAMPLE01",
  "scenario_id": "RouteID_SAMPLE01",
  "matrix_version": 0,
  "source": "amazon",
  "depot": {
    "id": "StopID_STATION",
    "x": -122.2015,
    "y": 47.6101
  },
  "vehicles": [
    {
      "id": "RouteID_SAMPLE01",
      "capacity": 4247527.0,
      "remaining_capacity": 4247527.0,
      "status": "AVAILABLE",
      "current_stop": "StopID_STATION",
      "start_time": 0.0
    }
  ],
  "orders": [
    {
      "id": "StopID_001",
      "x": -122.162577,
      "y": 47.587967,
      "demand": 20938.0,
      "release_time": 0.0,
      "ready_time": 0.0,
      "deadline": 999999.0,
      "service_time": 30.0,
      "status": "PENDING"
    },
    {
      "id": "StopID_002",
      "x": -122.248767,
      "y": 47.566065,
      "demand": 7168.0,
      "release_time": 0.0,
      "ready_time": 0.0,
      "deadline": 999999.0,
      "service_time": 45.0,
      "status": "PENDING"
    },
    {
      "id": "StopID_003",
      "x": -122.203929,
      "y": 47.603295,
      "demand": 17574.0,
      "release_time": 0.0,
      "ready_time": 0.0,
      "deadline": 999999.0,
      "service_time": 60.0,
      "status": "PENDING"
    },
    {
      "id": "StopID_004",
      "x": -122.153606,
      "y": 47.573354,
      "demand": 49326.0,
      "release_time": 0.0,
      "ready_time": 7200.0,
      "deadline": 14400.0,
      "service_time": 135.0,
      "status": "PENDING"
    },
    {
      "id": "StopID_005",
      "x": -122.203971,
      "y": 47.568167,
      "demand": 25488.0,
      "release_time": 0.0,
      "ready_time": 14400.0,
      "deadline": 21600.0,
      "service_time": 120.0,
      "status": "PENDING"
    },
    {
      "id": "StopID_006",
      "x": -122.246465,
      "y": 47.644187,
      "demand": 25040.0,
      "release_time": 0.0,
      "ready_time": 3600.0,
      "deadline": 10800.0,
      "service_time": 165.0,
      "status": "PENDING"
    },
    {
      "id": "StopID_007",
      "x": -122.181643,
      "y": 47.585406,
      "demand": 18759.0,
      "release_time": 0.0,
      "ready_time": 0.0,
      "deadline": 999999.0,
      "service_time": 30.0,
      "status": "PENDING"
    },
    {
      "id": "StopID_008",
      "x": -122.232251,
      "y": 47.58857,
      "demand": 46542.0,
      "release_time": 0.0,
      "ready_time": 18000.0,
      "deadline": 25200.0,
      "service_time": 120.0,
      "status": "PENDING"
    },
    {
      "id": "StopID_009",
      "x": -122.17601,
      "y": 47.623907,
      "demand": 52005.0,
      "release_time": 0.0,
      "ready_time": 3600.0,
      "deadline": 18000.0,
      "service_time": 195.0,
      "status": "PENDING"
    },
    {
      "id": "StopID_010",
      "x": -122.174754,
      "y": 47.629685,
      "demand": 14996.0,
      "release_time": 0.0,
      "ready_time": 0.0,
      "deadline": 999999.0,
      "service_time": 60.0,
      "status": "PENDING"
    }
  ],
  "time_matrix": {
    "StopID_STATION": {
      "StopID_STATION": 0.0,
      "StopID_001": 548.7,
      "StopID_002": 868.8,
      "StopID_003": 111.9,
      "StopID_004": 781.9,
      "StopID_005": 670.8,
      "StopID_006": 729.1,
      "StopID_007": 449.0,
      "StopID_008": 477.7,
      "StopID_009": 352.4,
      "StopID_010": 425.5
    },
    "StopID_001": {
      "StopID_STATION": 548.8,
      "StopID_001": 0.0,
      "StopID_002": 992.9,
      "StopID_003": 508.7,
      "StopID_004": 252.8,
      "StopID_005": 547.1,
      "StopID_006": 1274.9,
      "StopID_007": 209.6,
      "StopID_008": 751.2,
      "StopID_009": 592.4,
      "StopID_010": 679.6
    },
    "StopID_002": {
      "StopID_STATION": 869.1,
      "StopID_001": 993.3,
      "StopID_002": 0.0,
      "StopID_003": 766.8,
      "StopID_004": 1032.9,
      "StopID_005": 484.3,
      "StopID_006": 1248.9,
      "StopID_007": 787.2,
      "StopID_008": 401.4,
      "StopID_009": 1212.7,
      "StopID_010": 1292.8
    },
    "StopID_003": {
      "StopID_STATION": 111.9,
      "StopID_001": 508.6,
      "StopID_002": 766.6,
      "StopID_003": 0.0,
      "StopID_004": 723.3,
      "StopID_005": 561.5,
      "StopID_006": 798.4,
      "StopID_007": 373.4,
      "StopID_008": 385.4,
      "StopID_009": 446.2,
      "StopID_010": 526.1
    },
    "StopID_004": {
      "StopID_STATION": 782.1,
      "StopID_001": 252.8,
      "StopID_002": 1032.8,
      "StopID_003": 723.5,
      "StopID_004": 0.0,
      "StopID_005": 549.4,
      "StopID_006": 1511.5,
      "StopID_007": 358.5,
      "StopID_008": 882.3,
      "StopID_009": 843.4,
      "StopID_010": 928.8
    },
    "StopID_005": {
      "StopID_STATION": 670.8,
      "StopID_001": 547.2,
      "StopID_002": 484.3,
      "StopID_003": 561.5,
      "StopID_004": 549.5,
      "StopID_005": 0.0,
      "StopID_006": 1298.7,
      "StopID_007": 365.9,
      "StopID_008": 446.5,
      "StopID_009": 940.6,
      "StopID_010": 1032.6
    },
    "StopID_006": {
      "StopID_STATION": 728.9,
      "StopID_001": 1274.2,
      "StopID_002": 1248.9,
      "StopID_003": 798.1,
      "StopID_004": 1510.6,
      "StopID_005": 1298.4,
      "StopID_006": 0.0,
      "StopID_007": 1170.5,
      "StopID_008": 902.1,
      "StopID_009": 825.1,
      "StopID_010": 806.3
    },
    "StopID_007": {
      "StopID_STATION": 449.0,
      "StopID_001": 209.6,
      "StopID_002": 786.9,
      "StopID_003": 373.5,
      "StopID_004": 358.4,
      "StopID_005": 365.9,
      "StopID_006": 1171.0,
      "StopID_007": 0.0,
      "StopID_008": 547.9,
      "StopID_009": 618.4,
      "StopID_010": 711.6
    },
    "StopID_008": {
      "StopID_STATION": 477.8,
      "StopID_001": 751.2,
      "StopID_002": 401.4,
      "StopID_003": 385.5,
      "StopID_004": 882.0,
      "StopID_005": 446.4,
      "StopID_006": 902.1,
      "StopID_007": 547.9,
      "StopID_008": 0.0,
      "StopID_009": 828.6,
      "StopID_010": 903.4
    },
    "StopID_009": {
      "StopID_STATION": 352.3,
      "StopID_001": 592.4,
      "StopID_002": 1212.1,
      "StopID_003": 446.1,
      "StopID_004": 843.3,
      "StopID_005": 940.5,
      "StopID_006": 825.3,
      "StopID_007": 618.4,
      "StopID_008": 828.3,
      "StopID_009": 0.0,
      "StopID_010": 93.3
    },
    "StopID_010": {
      "StopID_STATION": 425.4,
      "StopID_001": 679.6,
      "StopID_002": 1292.2,
      "StopID_003": 526.0,
      "StopID_004": 928.8,
      "StopID_005": 1032.4,
      "StopID_006": 806.5,
      "StopID_007": 711.6,
      "StopID_008": 903.0,
      "StopID_009": 93.3,
      "StopID_010": 0.0
    }
  }
}
